<?xml version="1.0" encoding="UTF-8"?>
<Root xmlns:xsi="http://www.w3.org/2001/XMLSchema-instance" xsi:noNamespaceSchemaLocation="Teste.xsd">
	<item>
		<NomeComponente>RFIN102F</NomeComponente>
		<AlterouPDC>N達o</AlterouPDC>
		<BookEntradaAlterado>N達o</BookEntradaAlterado>
		<BookSaidaAlterado>N達o</BookSaidaAlterado>
		<FluxoPDCAlterado>N達o</FluxoPDCAlterado>
		<PacoteChangeman>RFIN000487</PacoteChangeman>
		<Demanda>TH</Demanda>
		<DataImplantacao>Proxima</DataImplantacao></item></Root>
